{
  "$schema": "http://json-schema.org/draft-07/schema#",
  "$id": "https://yuzi.local/schemas/yuzi-beautify.schema.json",
  "title": "Yuzi Beautify Bundle",
  "type": "object",
  "additionalProperties": false,
  "required": [
    "format",
    "formatVersion",
    "apiVersion",
    "manifest",
    "files"
  ],
  "properties": {
    "format": {
      "const": "yuzi-beautify-preset"
    },
    "formatVersion": {
      "type": "integer"
    },
    "apiVersion": {
      "type": "integer"
    },
    "manifest": {
      "type": "object"
    },
    "files": {
      "type": "object",
      "propertyNames": {
        "$ref": "#/definitions/packagePath"
      },
      "additionalProperties": {
        "$ref": "#/definitions/file"
      }
    }
  },
  "oneOf": [
    {
      "properties": {
        "formatVersion": {
          "const": 2
        },
        "apiVersion": {
          "const": 1
        },
        "manifest": {
          "$ref": "#/definitions/manifestV2"
        }
      }
    },
    {
      "properties": {
        "formatVersion": {
          "const": 3
        },
        "apiVersion": {
          "const": 2
        },
        "manifest": {
          "$ref": "#/definitions/manifestV3"
        }
      }
    }
  ],
  "definitions": {
    "nonEmptyString": {
      "type": "string",
      "minLength": 1,
      "pattern": "\\S"
    },
    "packagePath": {
      "type": "string",
      "minLength": 1,
      "pattern": "^(?!\\s)(?!.*\\s$)(?!/)(?![A-Za-z]:)(?![A-Za-z][A-Za-z0-9+.-]*:)(?!.*[\\\\?#\\x00-\\x1F\\x7F])(?!.*(?:^|/)\\.{1,2}(?:/|$))(?!.*//).+$"
    },
    "file": {
      "type": "object",
      "additionalProperties": false,
      "required": [
        "mimeType",
        "encoding",
        "content"
      ],
      "properties": {
        "mimeType": {
          "$ref": "#/definitions/nonEmptyString"
        },
        "encoding": {
          "enum": [
            "text",
            "base64"
          ]
        },
        "content": {
          "type": "string"
        }
      }
    },
    "target": {
      "type": "object",
      "additionalProperties": false,
      "required": [
        "tableName",
        "fields"
      ],
      "properties": {
        "tableName": {
          "$ref": "#/definitions/nonEmptyString"
        },
        "fields": {
          "type": "array",
          "minItems": 1,
          "uniqueItems": true,
          "items": {
            "$ref": "#/definitions/nonEmptyString"
          }
        }
      }
    },
    "entry": {
      "type": "object",
      "additionalProperties": false,
      "required": [
        "mount"
      ],
      "properties": {
        "html": {
          "$ref": "#/definitions/packagePath"
        },
        "css": {
          "$ref": "#/definitions/packagePath"
        },
        "mount": {
          "$ref": "#/definitions/packagePath"
        }
      }
    },
    "imageCanvas": {
      "type": "object",
      "additionalProperties": false,
      "required": [
        "tableName",
        "stableIdentityFields",
        "canvas",
        "promptFields"
      ],
      "properties": {
        "tableName": {
          "$ref": "#/definitions/nonEmptyString"
        },
        "stableIdentityFields": {
          "type": "array",
          "minItems": 1,
          "uniqueItems": true,
          "items": {
            "$ref": "#/definitions/nonEmptyString"
          }
        },
        "canvas": {
          "$ref": "#/definitions/nonEmptyString"
        },
        "promptFields": {
          "type": "array",
          "minItems": 1,
          "uniqueItems": true,
          "items": {
            "$ref": "#/definitions/nonEmptyString"
          }
        },
        "promptSuffix": {
          "type": "string",
          "description": "经用户确认的构图要求与可选补充描述；追加到表格字段描述，不代表出图尺寸参数。"
        }
      }
    },
    "item": {
      "type": "object",
      "additionalProperties": false,
      "required": [
        "id",
        "target",
        "entry"
      ],
      "properties": {
        "id": {
          "$ref": "#/definitions/nonEmptyString"
        },
        "name": {
          "type": "string"
        },
        "target": {
          "$ref": "#/definitions/target"
        },
        "entry": {
          "$ref": "#/definitions/entry"
        },
        "assets": {
          "type": "array",
          "uniqueItems": true,
          "items": {
            "$ref": "#/definitions/packagePath"
          }
        },
        "integrations": {
          "$ref": "#/definitions/integrations"
        },
        "imageGeneration": {
          "$ref": "#/definitions/imageGeneration"
        }
      }
    },
    "display": {
      "type": "object",
      "additionalProperties": false,
      "required": [
        "id",
        "name",
        "kind",
        "targets",
        "entry"
      ],
      "properties": {
        "id": {
          "$ref": "#/definitions/nonEmptyString"
        },
        "name": {
          "$ref": "#/definitions/nonEmptyString"
        },
        "kind": {
          "enum": [
            "inline",
            "popup",
            "barrage"
          ]
        },
        "targets": {
          "type": "array",
          "minItems": 1,
          "items": {
            "$ref": "#/definitions/target"
          }
        },
        "entry": {
          "$ref": "#/definitions/entry"
        },
        "assets": {
          "type": "array",
          "uniqueItems": true,
          "items": {
            "$ref": "#/definitions/packagePath"
          }
        },
        "integrations": {
          "$ref": "#/definitions/integrations"
        },
        "imageGeneration": {
          "$ref": "#/definitions/imageGeneration"
        },
        "interactions": {
          "$ref": "#/definitions/interactions"
        }
      },
      "allOf": [
        {
          "if": {
            "required": [
              "kind"
            ],
            "properties": {
              "kind": {
                "const": "inline"
              }
            }
          },
          "then": {},
          "else": {
            "not": {
              "anyOf": [
                {
                  "required": [
                    "imageGeneration"
                  ]
                },
                {
                  "required": [
                    "interactions"
                  ]
                }
              ]
            }
          }
        }
      ]
    },
    "manifestV2": {
      "type": "object",
      "additionalProperties": false,
      "required": [
        "id",
        "items"
      ],
      "properties": {
        "id": {
          "$ref": "#/definitions/nonEmptyString"
        },
        "name": {
          "type": "string"
        },
        "version": {
          "type": "string"
        },
        "author": {
          "type": "string"
        },
        "items": {
          "type": "array",
          "minItems": 1,
          "items": {
            "$ref": "#/definitions/item"
          }
        }
      }
    },
    "manifestV3": {
      "type": "object",
      "additionalProperties": false,
      "required": [
        "id",
        "items",
        "displays"
      ],
      "properties": {
        "id": {
          "$ref": "#/definitions/nonEmptyString"
        },
        "name": {
          "type": "string"
        },
        "version": {
          "type": "string"
        },
        "author": {
          "type": "string"
        },
        "items": {
          "type": "array",
          "items": {
            "$ref": "#/definitions/item"
          }
        },
        "displays": {
          "type": "array",
          "items": {
            "$ref": "#/definitions/display"
          }
        }
      }
    },
    "integrations": {
      "type": "object",
      "additionalProperties": false,
      "minProperties": 1,
      "properties": {
        "theme": {
          "const": true
        },
        "font": {
          "const": true
        }
      }
    },
    "imageGeneration": {
      "type": "object",
      "additionalProperties": false,
      "required": [
        "canvases"
      ],
      "properties": {
        "canvases": {
          "type": "array",
          "minItems": 1,
          "items": {
            "$ref": "#/definitions/imageCanvas"
          }
        }
      }
    },
    "interactions": {
      "type": "array",
      "minItems": 1,
      "uniqueItems": true,
      "items": {
        "enum": [
          "expand",
          "tabs",
          "append-input",
          "image-generate"
        ]
      }
    }
  }
}
