{
  "format": "yuzi-beautify-preset",
  "formatVersion": 3,
  "apiVersion": 2,
  "manifest": {
    "id": "zi-yong-biao-ge",
    "name": "自用表格美化",
    "version": "1.0.0",
    "author": "",
    "items": [
      {
        "id": "chronicle",
        "name": "纪要",
        "target": {
          "tableName": "纪要表",
          "fields": [
            "编码索引",
            "时间跨度",
            "与今天的关系",
            "概览",
            "纪要",
            "重要对话"
          ]
        },
        "entry": {
          "mount": "pages/summary/mount.js"
        },
        "assets": []
      },
      {
        "id": "global-state",
        "name": "全局",
        "target": {
          "tableName": "全局数据表",
          "fields": [
            "当前时间",
            "上轮场景时间",
            "经过的时间",
            "当前位置"
          ]
        },
        "entry": {
          "mount": "pages/global/mount.js"
        },
        "assets": []
      },
      {
        "id": "important-characters",
        "name": "重要角色",
        "target": {
          "tableName": "重要角色表",
          "fields": [
            "姓名",
            "角色类型",
            "性别",
            "年龄",
            "一句话介绍",
            "外貌特征",
            "穿着打扮",
            "基础属性",
            "特有属性",
            "所在地点",
            "在场状态",
            "人际关系"
          ]
        },
        "entry": {
          "mount": "pages/important-npc/mount.js"
        },
        "assets": []
      },
      {
        "id": "options",
        "name": "选项表",
        "target": {
          "tableName": "选项表",
          "fields": [
            "选项一",
            "选项二",
            "选项三",
            "选项四",
            "选项五"
          ]
        },
        "entry": {
          "mount": "pages/options/mount.js"
        },
        "assets": []
      },
      {
        "id": "protagonist-dossier",
        "name": "主角卷宗",
        "target": {
          "tableName": "主角信息",
          "fields": [
            "row_id",
            "姓名",
            "性别",
            "年龄",
            "外貌特征",
            "身份",
            "近况",
            "基础属性",
            "特有属性"
          ]
        },
        "entry": {
          "mount": "pages/protagonist/mount.js"
        },
        "integrations": {
          "font": true
        },
        "imageGeneration": {
          "canvases": [
            {
              "tableName": "主角信息",
              "stableIdentityFields": [
                "姓名"
              ],
              "canvas": "protagonist-avatar",
              "promptFields": [
                "性别",
                "年龄",
                "外貌特征",
                "身份"
              ],
              "promptSuffix": "单人头像，1∶1正方形构图，头肩特写，人物居中，头顶与两侧适当留白，适合头像框展示。"
            }
          ]
        },
        "assets": []
      }
    ],
    "displays": [
      {
        "id": "story-inline",
        "name": "剧情随记",
        "kind": "inline",
        "targets": [
          {
            "tableName": "全局数据表",
            "fields": [
              "当前时间",
              "当前位置",
              "经过的时间"
            ]
          },
          {
            "tableName": "纪要表",
            "fields": [
              "编码索引",
              "时间跨度",
              "概览",
              "纪要",
              "重要对话"
            ]
          },
          {
            "tableName": "主角信息",
            "fields": [
              "姓名",
              "性别",
              "年龄",
              "外貌特征",
              "身份",
              "近况",
              "特有属性"
            ]
          },
          {
            "tableName": "选项表",
            "fields": [
              "选项一",
              "选项二",
              "选项三",
              "选项四",
              "选项五"
            ]
          }
        ],
        "entry": {
          "mount": "displays/story-inline/mount.js"
        },
        "integrations": {
          "font": true
        },
        "imageGeneration": {
          "canvases": [
            {
              "tableName": "主角信息",
              "stableIdentityFields": [
                "姓名"
              ],
              "canvas": "protagonist-avatar",
              "promptFields": [
                "性别",
                "年龄",
                "外貌特征",
                "身份"
              ],
              "promptSuffix": "单人头像，1∶1正方形构图，头肩特写，人物居中，头顶与两侧适当留白，适合头像框展示。"
            }
          ]
        },
        "interactions": [
          "tabs",
          "append-input",
          "image-generate"
        ],
        "assets": []
      }
    ]
  },
  "files": {
    "displays/story-inline/mount.js": {
      "mimeType": "text/javascript",
      "encoding": "text",
      "content": "// displays/story-inline/mount.js\nvar normalize = (value) => String(value ?? \"\").normalize(\"NFKC\").trim();\nvar text = (value) => value == null ? \"\" : typeof value === \"object\" ? JSON.stringify(value, null, 2) : String(value);\nfunction records(state, name) {\n  const table = state?.tables?.find((table2) => normalize(table2.tableName) === normalize(name));\n  if (!Array.isArray(table?.headers) || !Array.isArray(table?.rows)) return [];\n  return table.rows.filter(Array.isArray).map((row) => Object.fromEntries(table.headers.map((header, i) => [normalize(header), row[i]])));\n}\nexport function mount(context) {\n  const { root, signal, actions = {} } = context;\n  const document = root.ownerDocument;\n  if (signal.aborted) return () => {\n  };\n  let disposed = false;\n  let revision = 0;\n  let activeTab = \"summary\";\n  let sending = false;\n  const element = (tag, className, value) => {\n    const node = document.createElement(tag);\n    node.className = className;\n    if (value !== void 0) node.textContent = value;\n    return node;\n  };\n  const card = element(\"section\", \"story-inline\");\n  card.setAttribute(\"aria-label\", \"剧情随记\");\n  const style = element(\"style\", \"\");\n  style.textContent = `\n.story-inline{--si-bg:#181c19;--si-panel:#202720;--si-ink:#e5e8de;--si-muted:#a4b19f;--si-line:#384335;--si-accent:#c4d1a6;box-sizing:border-box;width:100%;max-width:760px;margin:12px auto;color:var(--si-ink);background:var(--si-bg);border:1px solid var(--si-line);border-radius:18px;overflow:hidden;font:14px/1.65 var(--yuzi-content-preset-font-family,var(--yuzi-phone-font-family,system-ui));text-align:left;container-type:inline-size}\n.story-inline *{box-sizing:border-box;min-width:0}.story-inline [hidden]{display:none!important}.story-inline button{font:inherit;color:inherit;cursor:pointer}.story-inline button:disabled{cursor:default;opacity:.55}.story-inline button:focus-visible{outline:2px solid var(--si-accent);outline-offset:-3px}\n.story-inline .si-heading{display:flex;align-items:center;gap:10px;padding:15px 20px;border-bottom:1px solid var(--si-line);font-size:12px;letter-spacing:.16em;color:var(--si-accent)}.story-inline .si-dot{width:6px;height:6px;flex:none;border-radius:50%;background:var(--si-accent)}\n.story-inline .si-top{padding:20px}.story-inline .si-person+.si-person{margin-top:20px;padding-top:20px;border-top:1px solid var(--si-line)}.story-inline .si-profile{display:grid;grid-template-columns:84px minmax(0,1fr);gap:16px;align-items:center}.story-inline .si-avatar{width:84px;aspect-ratio:1;border:1px solid var(--si-line);border-radius:14px;background:linear-gradient(145deg,#374432,#232b22);display:grid;place-items:center;overflow:hidden;position:relative;color:var(--si-accent);font-size:27px}.story-inline .si-avatar img{position:absolute;inset:0;width:100%;height:100%;object-fit:cover}.story-inline .si-name{margin:0 0 7px;font-size:23px;font-weight:600;color:var(--si-ink);overflow-wrap:anywhere}.story-inline .si-tags{display:flex;gap:6px;flex-wrap:wrap}.story-inline .si-tag{padding:2px 8px;border:1px solid var(--si-line);border-radius:6px;color:var(--si-accent);font-size:12px;white-space:pre-wrap;overflow-wrap:anywhere}\n.story-inline .si-details{display:grid;gap:12px;margin:18px 0 0}.story-inline .si-field{margin:0}.story-inline .si-label{font-size:11px;letter-spacing:.08em;color:var(--si-muted);margin:0 0 4px}.story-inline .si-value{margin:0;white-space:pre-wrap;overflow-wrap:anywhere;color:var(--si-ink)}.story-inline .si-global{display:grid;grid-template-columns:repeat(3,minmax(0,1fr));gap:12px;margin-top:20px;padding:14px;background:var(--si-panel);border:1px solid var(--si-line);border-radius:10px}.story-inline .si-global .si-value{font-size:12px}\n.story-inline .si-tabs{display:flex;border-block:1px solid var(--si-line);padding:0 20px;gap:24px}.story-inline .si-tab{min-height:46px;padding:10px 4px;background:none;border:0;border-bottom:2px solid transparent;border-radius:0;color:var(--si-muted)}.story-inline .si-tab[aria-selected=true]{border-bottom-color:var(--si-accent);color:var(--si-accent)}\n.story-inline .si-panel{padding:20px;max-height:520px;overflow:auto;overscroll-behavior:auto;scrollbar-width:thin;scrollbar-color:var(--si-line) transparent}.story-inline .si-entry{display:grid;gap:14px}.story-inline .si-entry+.si-entry{border-top:1px solid var(--si-line);margin-top:20px;padding-top:20px}.story-inline .si-meta{display:flex;flex-wrap:wrap;gap:8px;color:var(--si-muted);font-size:12px}.story-inline .si-dialogue{padding:12px 14px;border-left:2px solid #87996d;background:var(--si-panel);border-radius:0 8px 8px 0}.story-inline .si-options{display:grid;gap:9px}.story-inline .si-option{display:grid;grid-template-columns:26px minmax(0,1fr) 16px;gap:10px;align-items:start;width:100%;padding:13px;background:var(--si-panel);border:1px solid var(--si-line);border-radius:10px;text-align:left}.story-inline .si-option:hover:not(:disabled){border-color:#87996d;background:#293126}.story-inline .si-number{font-size:11px;color:var(--si-accent);padding-top:3px}.story-inline .si-hint,.story-inline .si-empty{color:var(--si-muted);font-size:12px;margin:0}.story-inline .si-hint{margin-bottom:12px}.story-inline .si-status{padding:0 20px 12px;color:var(--si-accent);font-size:12px}.story-inline .si-status:empty{display:none}\n@container(max-width:360px){.story-inline .si-top